<?xml version='1.0' encoding='UTF-8' ?>

<!-- A skeleton JBoss MBean service descriptor DTD. This cannot be used in
general to validate a jboss-service.xml descriptor do to the fact that the attribute
element allows ANY content.

$Id: jboss-service_3_2.dtd,v 1.1.2.7 2003/10/30 13:42:24 ejort Exp $

DOCTYPE server
    PUBLIC "-//JBoss//DTD MBean Service 3.2//EN"
    "http://www.jboss.org/j2ee/dtd/jboss-service_3_2.dtd"
-->
<!-- The server element is the root element.
-->
<!ELEMENT server (loader-repository? , local-directory* , classpath* , mbean*)>

<!-- The loader-repository specifies the name of the UnifiedLoaderRepository
   MBean to use for the ear to provide ear level scoping of classes deployed
   in the ear. It is a unique JMX ObjectName string. It may also specify
   an arbitrary configuration by including a loader-repository-config element.

Examples:
   <loader-repository>jboss.test:loader=cts-cmp2v1-sar.ear</loader-repository>

   <loader-repository loaderRepositoryClass='dot.com.LoaderRepository'>
      dot.com:loader=unique-archive-name
      <loader-repository-config configParserClass='dot.com.LoaderParser'>
         java2ParentDelegaton=true
      </loader-repository-config>
   </loader-repository>
-->
<!ELEMENT loader-repository (#PCDATA | loader-repository-config)*>

<!-- The loaderRepositoryClass attribute gives the classname of the
org.jboss.mx.loading.LoaderRepository implementation.
-->
<!ATTLIST loader-repository loaderRepositoryClass CDATA  #IMPLIED>

<!-- The loader-repository-config element specifies any arbitrary configuration
fragment for use in configuring the loader-repository instance. The actual
content of this element is specific to the loaderRepositoryClass and the
code parsing the element.
-->
<!ELEMENT loader-repository-config (#PCDATA)>

<!-- The configParserClass attribute gives the classname of the
org.jboss.mx.loading.LoaderRepositoryFactory.LoaderRepositoryConfigParser
implementation to use to parse the loader-repository-config content.
-->
<!ATTLIST loader-repository-config configParserClass CDATA  #IMPLIED>

<!-- A local-directory element specifies that portions of the sar are to be unjard into the data
directory of the server configuration.
-->
<!ELEMENT local-directory EMPTY>

<!-- The optional path attribute gives the prefix of the sar entries that should be copied
into the data directory. If it is not specified the entire sar contents will be placed into
the data directory.
-->
<!ATTLIST local-directory path CDATA  #IMPLIED>

<!-- A classpath element specifies a location which will be included in the services
deployment classpath.
-->
<!ELEMENT classpath EMPTY>

<!-- The codebase attribute specifies the base URL from which the jars or classes
are loaded from. If the codebase is '.' then it is equal to the mbean deployment URL.
Otherwise, it is resolved as a path spec relative to the serverHomeURL (e.g., file:/jboss-3.2.0)
using the URL ctor URL(serverHomeURL, codebase)

Examples:

   <classpath codebase='.' archives='util.jar' />
   <classpath codebase='http://classloader.dot.com' archives='*' />
   <classpath codebase="lib" archives="*"/>
-->
<!ATTLIST classpath codebase CDATA  #REQUIRED>

<!-- The archives attribute specifies either the '*' wildcard to indicate all contents of the
codebase should be included, or a comma seperated list of the jars to include.
-->
<!ATTLIST classpath archives CDATA  #IMPLIED>

<!-- The mbean element defines a JBoss MBean service. This includes the
mbean class, attributes and dependencies.
-->
<!ELEMENT mbean (constructor? , xmbean? , attribute* , depends* , depends-list*)>

<!-- The code attributes gives the fully qualified name of the MBean
implementation class.
-->
<!ATTLIST mbean code      CDATA  #REQUIRED>

<!-- The name attribute gives the JMX ObjectName string to use when registering
the MBean. This must be a unique and valid JMX name.
-->
<!ATTLIST mbean name      CDATA  #REQUIRED>

<!-- The xmbean-dd attribute defines the path to the JBoss XMBean descriptor. This
is an xml document conforming to:

<!DOCTYPE mbean PUBLIC
      "-//JBoss//DTD JBOSS XMBEAN 1.0//EN"
      "http://www.jboss.org/j2ee/dtd/jboss_xmbean_1_0.dtd">

If the descriptor is embedded via a nested xmbean element, the xmbean-dd attribute
must be given as an empty string.

Example:
	<mbean code="org.jboss.test.jmx.xmbean.User"
		name="jboss.test:service=xmbean-user"
		xmbean-dd="META-INF/org/jboss/test/jmx/xmbean/User.xml" />
-->
<!ATTLIST mbean xmbean-dd CDATA  #IMPLIED>

<!-- The optional xmbean-code attribute specifies the ModelMBean implementation class
to use. This defaults to org.jboss.mx.modelmbean.XMBean.
-->
<!ATTLIST mbean xmbean-code CDATA  #IMPLIED>

<!-- The xmbean element specifies a nested JBoss XMBean descriptor fragment. Its
supported content model is the same as the mbean element of the jboss_xmbean_1_0.dtd

Example:
	<mbean code="org.jboss.test.jmx.xmbean.User"
		name="jboss.test:service=xmbean-user"
		xmbean-dd="">
		<xmbean>
			...
		</xmbean>
	</mbean>
-->
<!ELEMENT xmbean ANY>

<!-- The constructor element defines a non-default constructor to use when
instantiating the mbean.
-->
<!ELEMENT constructor (arg*)>

<!-- The arg element specify the constructor arguments in the order of the
ctor signature. Each arg has a type and value attribute.
-->
<!ELEMENT arg EMPTY>

<!-- The type attribute gives the type of the argument as defined in the
ctor signature. If not defined java.lang.String is assumed.
-->
<!ATTLIST arg type  CDATA  #IMPLIED>

<!-- The value attribute provides the string representation of the ctor
argument. It is converted from a string to type using Java PropertyEditor or a
ctor taking a single string as its argument.
-->
<!ATTLIST arg value CDATA  #REQUIRED>

<!-- The attribute element specifies the initial value for a management attribute of
the enclosing mbean. Typically the value of the attribute element is the string
representation of the attribute, but it can be an arbitrary xml fragment that is
parsed by the mbean.
-->
<!ELEMENT attribute ANY>

<!-- The required name attribute gives the name of the attribute. This is the
name exposed by the mbean to the MBeanServer for the attribute.
-->
<!ATTLIST attribute name CDATA  #REQUIRED>

<!-- The optional replace attribute indicates whether references of the form ${x}
in the attribute element content should be replaced with the corresponding
System.getProperty(x) value.
-->
<!ATTLIST attribute replace (true | false) 'true'>
<!-- The optional trim attribute specifies whether the attribute element content should
be trimmed of whitespace.
-->
<!ATTLIST attribute trim (true | false) 'true'>

<!-- The depends element specifies a JMX ObjectName string for a mbean
on which the enclosing mbean depends.

Example:
   <mbean code="myBean" name="domain:name=x">
      <depends optional-attribute-name="yName">domain:name=y</depends>
   </mbean>

   <mbean code="myBean" name="domain:name=x">
      <depends optional-attribute-name="anonName">
         <mbean code="nestedBean" name="domain:name=x.y">
         ...
         </mbean>
      </depends>
   </mbean>
-->
<!ELEMENT depends (#PCDATA | mbean)*>

<!-- The optional-attribute-name attribute specifies the attribute name
which should be populated with the JMX ObjectName of the depends element.
This allows an mbean to have access to the name of the mbean on which
it depends.
-->
<!ATTLIST depends optional-attribute-name CDATA  #IMPLIED>

<!-- The proxy-type attribute specifies the interface name
that should be exposed on an MBeanProxy pointing at the dependent
MBean specified by the JMX ObjectName

The special value proxy-type="attribute" will use the
class declared in the MBeanAttributeInfo as the interface
for MBeanProxy.

e.g.
   <mbean code="org.jboss.example.Helper" name="domain:name=helper"/>
   
   <mbean code="myBean" name="domain:name=x">
      <depends optional-attribute-name="Helper"
               proxy-type="org.jboss.example.HelperMBean"
      >domain:name=helper</depends>
   </mbean>
   
   <mbean code="myBean" name="domain:name=x">
      <depends optional-attribute-name="Helper"
               proxy-type="attribute"
      >domain:name=helper</depends>
   </mbean>
-->
<!ATTLIST depends proxy-type CDATA  #IMPLIED>

<!-- The depends-list element specifies a series of JMX ObjectName
strings for a mbeans on which the enclosing mbean depends. This is
done using

Example:
   <mbean code="myBean" name="domain:name=x">
      <depends-list optional-attribute-name="myObjectNameList">
         <depends-list-element>domain:name=y</depends-list-element>
         <depends-list-element>domain:name=z</depends-list-element>
      </depends-list>
   </mbean>
-->
<!ELEMENT depends-list (depends-list-element)+>

<!-- The optional-attribute-name attribute specifies the attribute name
which should be populated with the JMX ObjectName[] array of the depends-list
elements. This allows an mbean to have access to the names of the mbean on
which it depends.
-->
<!ATTLIST depends-list optional-attribute-name CDATA  #IMPLIED>

<!-- The depends-list-element element specifies a JMX ObjectName string
for a mbean on which the enclosing mbean depends.
-->
<!ELEMENT depends-list-element (#PCDATA | mbean)*>

