<?xml version="1.0" encoding="UTF-8"?>

<!DOCTYPE server
    PUBLIC "-//JBoss//DTD MBean Service 3.2//EN"
    "http://www.jboss.org/j2ee/dtd/jboss-service_3_2.dtd">

<server>

   <mbean code="org.jboss.test.jmx.attrs.AttrTests"
      name="test:name=AttrTests,case=#1">
      <attribute name="XmlString"><![CDATA[
<depinfo>
<value name='abc'>A Value</value>
</depinfo>]]>
      </attribute>
      <attribute name="SysPropRef">${java.vm.version}</attribute>
      <attribute name="TrimedString">  123456789    
      </attribute>
   </mbean>

   <mbean code="org.jboss.test.jmx.attrs.AttrTests"
      name="test:name=AttrTests,case=#2">
      <attribute name="SysPropRef" replace="false">${java.vm.version}</attribute>
      <attribute name="TrimedString" trim="false"> 123456789 </attribute>
   </mbean>

</server>
